{
  "meta": {
    "name": "Référentiel d'évaluation de la maturité IA",
    "version": "1.0.0",
    "date": "2026-06-22",
    "language": "fr",
    "scale": {
      "internal_min": 0,
      "internal_max": 4,
      "presented_min": 1,
      "presented_max": 5,
      "model": "CMMI-inspired",
      "note": "Réponses et scores internes sur [0,4] (5 modalités). Niveau présenté = score + 1 sur [1,5]."
    },
    "level_labels": {
      "0": "Initial — inexistant ou informel",
      "1": "Émergent — premières initiatives non structurées",
      "2": "Défini — pratiques documentées mais partielles",
      "3": "Géré — pratiques systématiques et pilotées",
      "4": "Optimisé — pratiques automatisées et en amélioration continue"
    },
    "referential_sources": {
      "PwC": {
        "label": "PwC AI Maturity Assessment",
        "role": "Ancrage générique : structure les axes Stratégie, Talents, Technologie.",
        "type": "framework_conseil"
      },
      "DAMA-DMBOK": {
        "label": "DAMA Data Management Body of Knowledge",
        "role": "Ancrage générique : structure l'axe Données (qualité, architecture, gouvernance, métadonnées).",
        "type": "corpus_de_connaissances"
      },
      "ISO42001": {
        "label": "ISO/IEC 42001:2023 — AI Management System",
        "role": "Ancrage générique : structure l'axe Gouvernance (système de management du risque IA).",
        "type": "norme"
      },
      "NIST-AI-RMF": {
        "label": "NIST AI Risk Management Framework 1.0",
        "role": "Couche IA-spécifique : biais, traçabilité des données, risques LLM (fonctions GOVERN/MAP/MEASURE/MANAGE).",
        "type": "framework_risque"
      },
      "EU-AI-Act": {
        "label": "Règlement (UE) 2024/1689 — AI Act",
        "role": "Couche IA-spécifique : classification par niveau de risque, inventaire, documentation technique (Annexe IV).",
        "type": "reglementation"
      },
      "McKinsey": {
        "label": "McKinsey — The State of AI",
        "role": "Données empiriques de calibration (taux d'adoption, leviers de valeur) ; appui des axes Stratégie/Talents/Technologie.",
        "type": "etude_empirique"
      }
    },
    "weighting": {
      "method": "fuzzy_ahp",
      "note": "Les poids d'axes ci-dessous sont des valeurs de repli (récapitulatif initial). Les poids faisant foi sont calculés par Fuzzy AHP à partir de data/weights/ahp_pairwise.json (cf. maturai.weighting).",
      "fallback_axis_weights": {
        "strategy": 0.20,
        "data": 0.20,
        "talents": 0.15,
        "technology": 0.15,
        "governance": 0.30
      }
    }
  },

  "context_section": {
    "id": "context",
    "name": "Contexte (hors scoring)",
    "scored": false,
    "questions": [
      {
        "id": "Q1", "field": "sector", "text": "Dans quel secteur opère votre organisation ?",
        "type": "single_choice",
        "options": ["Banque/Assurance", "Santé", "Industrie/Manufacturing", "Retail/Distribution", "Secteur public", "Télécom/Tech", "Énergie/Utilities", "Transport/Logistique", "Autre"],
        "usage": "Contextualisation sectorielle du rapport LLM (étape 6) et des KPI."
      },
      {
        "id": "Q2", "field": "region", "text": "Dans quelle région êtes-vous basé ?",
        "type": "single_choice",
        "options": ["France", "Europe (hors France)", "Amérique du Nord", "Moyen-Orient/Afrique", "Asie-Pacifique", "Autre"],
        "usage": "Détermine l'applicabilité réglementaire (ex. EU AI Act / RGPD)."
      },
      {
        "id": "Q3", "field": "headcount", "text": "Nombre total d'employés ?",
        "type": "single_choice",
        "options": ["< 50", "50–249", "250–999", "1000–4999", "≥ 5000"],
        "graph_rag": {"hint": "Chercher entité 'effectif total' dans documents RH", "target_entities": ["effectif total", "headcount"]}
      },
      {
        "id": "Q4", "field": "revenue", "text": "Chiffre d'affaires annuel approximatif ?",
        "type": "single_choice",
        "options": ["< 10 M€", "10–50 M€", "50–250 M€", "250 M€–1 Md€", "> 1 Md€"],
        "graph_rag": {"hint": "Chercher 'chiffre d'affaires' dans rapports financiers", "target_entities": ["chiffre d'affaires", "revenue"]}
      },
      {
        "id": "Q5", "field": "role", "text": "Quel est votre rôle ?",
        "type": "single_choice",
        "options": ["Direction générale (COMEX)", "Direction IT/Data", "Métier/Opérationnel", "Conformité/Risque", "Autre"],
        "usage": "Sert à pondérer la fiabilité des réponses par partie prenante (multi-répondants)."
      },
      {
        "id": "Q6", "field": "department", "text": "Dans quel département travaillez-vous ?",
        "type": "single_choice",
        "options": ["Direction", "IT/SI", "Data/IA", "Métier", "Juridique/Conformité", "RH", "Finance", "Autre"],
        "usage": "Idem Q5 — calibration de la fiabilité par profil de répondant."
      }
    ]
  },

  "axes": [
    {
      "id": "strategy", "code": "AXE1", "name": "Stratégie",
      "weight": 0.20,
      "anchor": ["PwC", "McKinsey"],
      "subdomains": [
        {
          "id": "1.1", "name": "Vision et alignement business", "weight": 1.0,
          "questions": [
            {
              "id": "Q7", "weight": 1.0, "layer": "generic",
              "text": "L'IA figure-t-elle explicitement dans votre plan stratégique à 3 ans ?",
              "levels": [
                {"score": 0, "label": "Absente de toute réflexion stratégique"},
                {"score": 1, "label": "Évoquée informellement, sans document associé"},
                {"score": 2, "label": "Mentionnée dans la stratégie globale, sans plan dédié"},
                {"score": 3, "label": "Plan IA formalisé, mais non chiffré ni daté"},
                {"score": 4, "label": "Plan IA formalisé, daté et chiffré sur 3 ans"}
              ],
              "referential": {"sources": ["PwC", "McKinsey"], "justification": "L'alignement IA-stratégie est le premier déterminant de la création de valeur (PwC ; McKinsey State of AI)."},
              "graph_rag": {"hint": "Chercher entité 'Stratégie IA' ou 'Plan IA' dans les documents de planification", "target_entities": ["Stratégie IA", "Plan IA"]}
            },
            {
              "id": "Q8", "weight": 1.0, "layer": "generic",
              "text": "Votre organisation a-t-elle défini des objectifs métiers précis pour ses projets IA (efficacité, revenu, innovation) ?",
              "levels": [
                {"score": 0, "label": "Aucun objectif identifié"},
                {"score": 1, "label": "Objectifs vagues, non mesurables"},
                {"score": 2, "label": "Un objectif unique documenté (ex. efficacité)"},
                {"score": 3, "label": "Plusieurs objectifs documentés mais sans KPI associé"},
                {"score": 4, "label": "Objectifs multiples, documentés et mesurés (efficacité, revenu, innovation)"}
              ],
              "referential": {"sources": ["PwC", "McKinsey"], "justification": "La traduction de l'IA en objectifs métiers mesurables distingue les organisations performantes (McKinsey)."},
              "graph_rag": {"hint": "Chercher 'objectifs IA' relié à 'KPI business' dans plans stratégiques", "target_entities": ["objectifs IA", "KPI business"]}
            },
            {
              "id": "Q9", "weight": 1.0, "layer": "generic",
              "text": "Votre organisation a-t-elle réalisé une évaluation de l'impact de l'IA sur son secteur ?",
              "levels": [
                {"score": 0, "label": "Aucune évaluation menée"},
                {"score": 1, "label": "Veille informelle, non documentée"},
                {"score": 2, "label": "Étude partielle sur un segment du secteur"},
                {"score": 3, "label": "Étude complète mais ancienne (plus de 18 mois)"},
                {"score": 4, "label": "Étude complète et régulièrement mise à jour"}
              ],
              "referential": {"sources": ["PwC", "McKinsey"], "justification": "L'analyse de l'impact sectoriel conditionne la pertinence des priorités IA (PwC)."},
              "graph_rag": {"hint": "Chercher 'rapport impact IA' ou 'étude sectorielle IA'", "target_entities": ["rapport impact IA", "étude sectorielle IA"]}
            }
          ]
        },
        {
          "id": "1.2", "name": "Sponsor exécutif et pilotage", "weight": 1.0,
          "questions": [
            {
              "id": "Q10", "weight": 1.0, "layer": "generic",
              "text": "Votre direction générale a-t-elle une compréhension approfondie des enjeux IA ?",
              "levels": [
                {"score": 0, "label": "Aucune connaissance des enjeux IA"},
                {"score": 1, "label": "Sensibilisation ponctuelle (une présentation, un atelier)"},
                {"score": 2, "label": "Compréhension basique des cas d'usage"},
                {"score": 3, "label": "Compréhension intermédiaire, implication dans les décisions IA"},
                {"score": 4, "label": "Compréhension avancée, formation continue des dirigeants"}
              ],
              "referential": {"sources": ["PwC", "McKinsey"], "justification": "Le sponsorship exécutif est corrélé au passage à l'échelle de l'IA (McKinsey)."},
              "graph_rag": {"hint": "Chercher 'COMEX' relié à 'IA' ou 'formation IA dirigeants'", "target_entities": ["COMEX", "formation IA dirigeants"]}
            },
            {
              "id": "Q11", "weight": 1.0, "layer": "generic",
              "text": "Existe-t-il un budget dédié aux projets IA pour l'année en cours ?",
              "levels": [
                {"score": 0, "label": "Aucun budget identifié"},
                {"score": 1, "label": "Dépenses ponctuelles non budgétées"},
                {"score": 2, "label": "Budget IA noyé dans le budget IT global"},
                {"score": 3, "label": "Ligne budgétaire IA identifiée mais limitée"},
                {"score": 4, "label": "Budget IA dédié, pluriannuel et significatif"}